{
  "schema_version": "1.0",
  "source": {
    "provider": "SAP",
    "type": "SAP Security Patch Day",
    "url": "https://support.sap.com/en/my-support/knowledge-base/security-notes-news/bulletin-2025.html",
    "retrieved_at": "2026-09-13T14:45:11.239250+00:00"
  },
  "patch_day": {
    "year": 2025,
    "month": 6,
    "month_name": "June",
    "scheduled_date": "2025-06-10"
  },
  "summary": {
    "announced_new_notes": 14,
    "announced_updates": null,
    "parsed_records": 14,
    "parsed_new_notes": 14,
    "parsed_updates": 0
  },
  "security_notes": [
    {
      "note_number": "3441087",
      "cve": [
        "CVE-2025-42984"
      ],
      "title": "[ CVE-2025-42984 ] Missing Authorization check in SAP S/4HANA (Manage Central Purchase Contract application) Product – SAP S/4HANA (Manage Central Purchase Contract application) Versions – S4CORE 106, 107, 108 Medium",
      "priority": "Medium",
      "cvss": 5.4,
      "affected_versions_raw": [],
      "status": "new",
      "source_text": "3441087 [ CVE-2025-42984 ] Missing Authorization check in SAP S/4HANA (Manage Central Purchase Contract application) Product – SAP S/4HANA (Manage Central Purchase Contract application) Versions – S4CORE 106, 107, 108 Medium 5.4"
    },
    {
      "note_number": "3560693",
      "cve": [
        "CVE-2025-23192"
      ],
      "title": "[ CVE-2025-23192 ] Cross-Site Scripting (XSS) vulnerability in SAP BusinessObjects Business Intelligence (BI Workspace) Product – SAP BusinessObjects Business Intelligence (BI Workspace) Versions – ENTERPRISE 430, 2025, 2027 High",
      "priority": "High",
      "cvss": 8.2,
      "affected_versions_raw": [],
      "status": "new",
      "source_text": "3560693 [ CVE-2025-23192 ] Cross-Site Scripting (XSS) vulnerability in SAP BusinessObjects Business Intelligence (BI Workspace) Product – SAP BusinessObjects Business Intelligence (BI Workspace) Versions – ENTERPRISE 430, 2025, 2027 High 8.2"
    },
    {
      "note_number": "3580384",
      "cve": [
        "CVE-2025-42993"
      ],
      "title": "[ CVE-2025-42993 ] Missing Authorization Check in SAP S/4HANA (Enterprise Event Enablement) Product – SAP S/4HANA (Enterprise Event Enablement) Versions – SAP_GWFND 757, 758 Medium",
      "priority": "Medium",
      "cvss": 6.7,
      "affected_versions_raw": [],
      "status": "new",
      "source_text": "3580384 [ CVE-2025-42993 ] Missing Authorization Check in SAP S/4HANA (Enterprise Event Enablement) Product – SAP S/4HANA (Enterprise Event Enablement) Versions – SAP_GWFND 757, 758 Medium 6.7"
    },
    {
      "note_number": "3585545",
      "cve": [
        "CVE-2025-42988"
      ],
      "title": "[ CVE-2025-42988 ] Server-Side Request Forgery in SAP Business Objects Business Intelligence Platform Product - SAP Business Objects Business Intelligence Platform Versions - ENTERPRISE 430, 2025, 2027 Low",
      "priority": "Low",
      "cvss": 3.7,
      "affected_versions_raw": [
        "ENTERPRISE 430",
        "2025",
        "2027"
      ],
      "status": "new",
      "source_text": "3585545 [ CVE-2025-42988 ] Server-Side Request Forgery in SAP Business Objects Business Intelligence Platform Product - SAP Business Objects Business Intelligence Platform Versions - ENTERPRISE 430, 2025, 2027 Low 3.7"
    },
    {
      "note_number": "3590887",
      "cve": [
        "CVE-2025-31325"
      ],
      "title": "[ CVE-2025-31325 ] Cross-Site Scripting (XSS) Vulnerability in SAP NetWeaver (ABAP Keyword Documentation) Product - SAP NetWeaver (ABAP Keyword Documentation) Version – SAP_BASIS 758 Medium",
      "priority": "Medium",
      "cvss": 5.8,
      "affected_versions_raw": [],
      "status": "new",
      "source_text": "3590887 [ CVE-2025-31325 ] Cross-Site Scripting (XSS) Vulnerability in SAP NetWeaver (ABAP Keyword Documentation) Product - SAP NetWeaver (ABAP Keyword Documentation) Version – SAP_BASIS 758 Medium 5.8"
    },
    {
      "note_number": "3594258",
      "cve": [
        "CVE-2025-42998"
      ],
      "title": "[ CVE-2025-42998 ] Security misconfiguration vulnerability in SAP Business One Integration Framework Product – SAP Business One Integration Framework Versions – B1_ON_HANA 10.0, SAP-M-BO 10.0 Medium",
      "priority": "Medium",
      "cvss": 5.3,
      "affected_versions_raw": [],
      "status": "new",
      "source_text": "3594258 [ CVE-2025-42998 ] Security misconfiguration vulnerability in SAP Business One Integration Framework Product – SAP Business One Integration Framework Versions – B1_ON_HANA 10.0, SAP-M-BO 10.0 Medium 5.3"
    },
    {
      "note_number": "3596850",
      "cve": [
        "CVE-2025-42987"
      ],
      "title": "[ CVE-2025-42987 ] Missing Authorization Check in SAP S/4HANA (Manage Processing Rules - For Bank Statement) Product – SAP S/4HANA (Manage Processing Rules - For Bank Statement) Versions – S4CORE 104, 105, 106, 107, 108 Medium",
      "priority": "Medium",
      "cvss": 4.3,
      "affected_versions_raw": [],
      "status": "new",
      "source_text": "3596850 [ CVE-2025-42987 ] Missing Authorization Check in SAP S/4HANA (Manage Processing Rules - For Bank Statement) Product – SAP S/4HANA (Manage Processing Rules - For Bank Statement) Versions – S4CORE 104, 105, 106, 107, 108 Medium 4.3"
    },
    {
      "note_number": "3600840",
      "cve": [
        "CVE-2025-42989"
      ],
      "title": "[ CVE-2025-42989 ] Missing Authorization check in SAP NetWeaver Application Server for ABAP Product – SAP NetWeaver Application Server for ABAP Versions – KERNEL 7.89, 7.93, 9.14, 9.15 Critical",
      "priority": "Critical",
      "cvss": 9.6,
      "affected_versions_raw": [],
      "status": "new",
      "source_text": "3600840 [ CVE-2025-42989 ] Missing Authorization check in SAP NetWeaver Application Server for ABAP Product – SAP NetWeaver Application Server for ABAP Versions – KERNEL 7.89, 7.93, 9.14, 9.15 Critical 9.6"
    },
    {
      "note_number": "3601169",
      "cve": [
        "CVE-2025-42990"
      ],
      "title": "[ CVE-2025-42990 ] HTML Injection in Unprotected SAPUI5 applications Product – SAPUI5 applications Versions – SAP_UI 750, 754, 755, 756, 757, 758, UI_700 200 Low",
      "priority": "Low",
      "cvss": 3.0,
      "affected_versions_raw": [],
      "status": "new",
      "source_text": "3601169 [ CVE-2025-42990 ] HTML Injection in Unprotected SAPUI5 applications Product – SAPUI5 applications Versions – SAP_UI 750, 754, 755, 756, 757, 758, UI_700 200 Low 3.0"
    },
    {
      "note_number": "3606484",
      "cve": [
        "CVE-2025-42983"
      ],
      "title": "[ CVE-2025-42983 ] Missing Authorization check in SAP Business Warehouse and SAP Plug-In Basis Product – SAP Business Warehouse and SAP Plug-In Basis Versions – PI_BASIS 2006_1_700, 701, 702, 731, 740, SAP_BW 750, 751, 752, 753, 754, 755, 756, 757, 758, 914, 915 High",
      "priority": "High",
      "cvss": 8.5,
      "affected_versions_raw": [],
      "status": "new",
      "source_text": "3606484 [ CVE-2025-42983 ] Missing Authorization check in SAP Business Warehouse and SAP Plug-In Basis Product – SAP Business Warehouse and SAP Plug-In Basis Versions – PI_BASIS 2006_1_700, 701, 702, 731, 740, SAP_BW 750, 751, 752, 753, 754, 755, 756, 757, 758, 914, 915 High 8.5"
    },
    {
      "note_number": "3608058",
      "cve": [
        "CVE-2025-42991"
      ],
      "title": "[ CVE-2025-42991 ] Missing Authorization check in SAP S/4HANA (Bank Account Application) Product - SAP S/4HANA (Bank Account Application) Version – S4CORE 108 Medium",
      "priority": "Medium",
      "cvss": 4.3,
      "affected_versions_raw": [],
      "status": "new",
      "source_text": "3608058 [ CVE-2025-42991 ] Missing Authorization check in SAP S/4HANA (Bank Account Application) Product - SAP S/4HANA (Bank Account Application) Version – S4CORE 108 Medium 4.3"
    },
    {
      "note_number": "3609271",
      "cve": [
        "CVE-2025-42982"
      ],
      "title": "[ CVE-2025-42982 ] Information Disclosure in SAP GRC (AC Plugin) Product – SAP GRC (AC Plugin) Versions – GRCPINW V1100_700, V1100_731 High",
      "priority": "High",
      "cvss": 8.8,
      "affected_versions_raw": [],
      "status": "new",
      "source_text": "3609271 [ CVE-2025-42982 ] Information Disclosure in SAP GRC (AC Plugin) Product – SAP GRC (AC Plugin) Versions – GRCPINW V1100_700, V1100_731 High 8.8"
    },
    {
      "note_number": "3610006",
      "cve": [
        "CVE-2025-42994",
        "CVE-2025-42995",
        "CVE-2025-42996"
      ],
      "title": "[ CVE-2025-42994 ] Multiple vulnerabilities in SAP MDM Server Related CVE - CVE-2025-42995 , CVE-2025-42996 Product – SAP MDM Server Versions – MDM_SERVER 710.750 High",
      "priority": "High",
      "cvss": 7.5,
      "affected_versions_raw": [],
      "status": "new",
      "source_text": "3610006 [ CVE-2025-42994 ] Multiple vulnerabilities in SAP MDM Server Related CVE - CVE-2025-42995 , CVE-2025-42996 Product – SAP MDM Server Versions – MDM_SERVER 710.750 High 7.5"
    },
    {
      "note_number": "3610591",
      "cve": [
        "CVE-2025-42977"
      ],
      "title": "[ CVE-2025-42977 ] Directory Traversal vulnerability in SAP NetWeaver Visual Composer Product – SAP NetWeaver Visual Composer Version – VCBASE 7.50 High",
      "priority": "High",
      "cvss": 7.6,
      "affected_versions_raw": [],
      "status": "new",
      "source_text": "3610591 [ CVE-2025-42977 ] Directory Traversal vulnerability in SAP NetWeaver Visual Composer Product – SAP NetWeaver Visual Composer Version – VCBASE 7.50 High 7.6"
    }
  ]
}
